{"schemaVersion":"1.0","id":"m8-frostbound-aligned","version":"0.1.0","status":"approved","name":"M8 Frostbound Aligned","provenance":{"createdAt":"2026-07-18T18:00:00+07:00","sources":[{"type":"human-design","reference":"docs/decisions/ADR-019-frostbound-aligned-m7-refinement.md"}]},"tokens":{"colors":{"primary":"#87EFFF","surface":"#102847","frame":"#B7F8FF","energy":"#D9FFFF","shadow":"#04101FFF"},"shape":{"cornerRadius":2,"strokeWidth":2},"lighting":{"highlightDirection":"top-left","shadowColor":"#04101FFF"},"spacing":{"contentInset":16,"angularCapInset":34,"actionGap":20},"material":{"grainOpacity":0.09,"patternOpacity":0.08,"patternScale":48,"edgeLightOpacity":0.6,"bevelDepth":3,"decalOpacity":0.2}},"renderDefaults":{"targetScale":2,"colorSpace":"sRGB","alphaMode":"straight"},"compatibility":{"minimumRendererVersion":"0.1.0","migrationNote":"M8 is a versioned successor; M7 receipts remain immutable."}}
