{"schemaVersion":"1.0","id":"m10-volcanic-forge","version":"0.1.0","status":"approved","name":"M10 Volcanic Forge","extends":{"id":"m7-reference-fidelity","version":"0.1.0"},"provenance":{"createdAt":"2026-07-19T00:00:00Z","sources":[{"type":"human-design","reference":"docs/decisions/ADR-021-volcanic-forge-second-style-transfer.md"}]},"tokens":{"colors":{"primary":"#E88931","secondary":"#9D5B24","surface":"#1A1110","accent":"#FFD27A"},"lighting":{"highlightDirection":"bottom","shadowColor":"#130807"},"material":{"grainOpacity":0.12,"patternOpacity":0.1,"patternScale":36,"edgeLightOpacity":0.46,"bevelDepth":3,"decalOpacity":0.18}},"renderDefaults":{"targetScale":2,"colorSpace":"sRGB","alphaMode":"straight"},"compatibility":{"minimumRendererVersion":"0.1.0","migrationNote":"M10 adds Volcanic Forge bindings without changing M7-M9 styles."}}
