{
  "schemaVersion": "1.0",
  "id": "neon-market",
  "version": "0.1.0",
  "status": "approved",
  "name": "Neon Market Overlay",
  "provenance": {
    "createdAt": "2026-07-16T09:00:00Z",
    "sources": [{ "type": "human-design", "reference": "docs/reference-briefs/V2_NEON_MARKET.md" }]
  },
  "extends": { "id": "neon-core", "version": "0.1.0" },
  "tokens": {
    "colors": { "accent": "#00E5FF" },
    "material": { "grainOpacity": 0.1, "patternOpacity": 0.08, "patternScale": 32, "edgeLightOpacity": 0.42, "bevelDepth": 2, "decalOpacity": 0.18 }
  },
  "renderDefaults": { "targetScale": 2, "colorSpace": "sRGB", "alphaMode": "straight" },
  "compatibility": { "minimumRendererVersion": "0.1.0" }
}
