{"schemaVersion":"1.0","id":"m11-enchanted-forest","version":"0.1.0","status":"approved","name":"M11 Enchanted Forest","extends":{"id":"m7-reference-fidelity","version":"0.1.0"},"provenance":{"createdAt":"2026-07-19T00:00:00Z","sources":[{"type":"human-design","reference":"docs/decisions/ADR-024-enchanted-forest-third-style-contrast.md"},{"type":"human-design","reference":"docs/decisions/ADR-025-enchanted-forest-definition-approval.md"}]},"tokens":{"colors":{"primary":"#66B980","secondary":"#527A59","surface":"#173025","accent":"#EDE3B4"},"lighting":{"highlightDirection":"top","shadowColor":"#0C1A14"},"material":{"grainOpacity":0.16,"patternOpacity":0.12,"patternScale":32,"edgeLightOpacity":0.38,"bevelDepth":3,"decalOpacity":0.16}},"renderDefaults":{"targetScale":2,"colorSpace":"sRGB","alphaMode":"straight"},"compatibility":{"minimumRendererVersion":"0.1.0","migrationNote":"M11 adds Enchanted Forest bindings through the shared composition seam."}}
